id,question_ar,cleaned_answer,topic,search_text,synonyms
1,ما هي إدارة المخاطر في التداول؟,"- تحديد نسبة المخاطرة في كل صفقة (1–2%).\n- استخدام أمر وقف الخسارة.\n- عدم زيادة حجم العقد بعد خسارة.","risk_management","إدارة المخاطر وقف خسارة نسبة مخاطرة رأس المال","إدارة مخاطر|Risk Management|وقف خسارة|Stop Loss"
2,كيف أتعامل مع الخسارة؟,"- اعتبر الخسارة جزءًا طبيعيًا من العملية.\n- دوّن السبب وتعلّم منه.\n- التزم بالخطة بدون انتقام تداول.","psychology","خسارة انتقام تداول انضباط خطة تداول","سيكولوجيا التداول|Trading Psychology|انضباط|Discipline"
3,ما هو التحليل الفني؟,"- دراسة حركة السعر على الرسوم البيانية.\n- تحديد الاتجاهات والدعم والمقاومة.\n- استخدام المتوسطات المتحركة والمؤشرات.","technical_analysis","تحليل فني ترند دعم مقاومة متوسط متحرك مؤشرات,""تحليل فني""|Technical Analysis|مؤشرات"
4,ما الفرق بين التحليل الفني والأساسي؟,"- الفني يعتمد على حركة السعر والأنماط.\n- الأساسي يعتمد على الأخبار والبيانات الاقتصادية.\n- الدمج يعطي رؤية أشمل.","comparison","مقارنة تحليل فني تحليل أساسي أخبار بيانات اقتصادية","Fundamental vs Technical|تحليل أساسي|أخبار|بيانات"
5,كيف أبدأ تعلم التداول؟,"- تعلّم الأساسيات أولًا.\n- ابدأ بحساب تجريبي.\n- طبّق إدارة رأس المال.\n- قيّم الأداء دوريًا.","beginners","مبتدئين حساب تجريبي أساسيات إدارة رأس المال تقييم أداء","مبتدئ|Beginner|Demo Account|أساسيات"
